Id,Text,Party
102918290599_162819843875903,"The sequestration cuts set to take place today are an unfortunate symptom of a greater problem, which is our governmentÛªs failure to act to find bipartisan solutions to the critical issues we face.  We need to address our debt and cut spending, but we need to do it in a responsible way, not with debilitating across the board cuts that will set back our economic progress and cause deep cuts in places where we canÛªt afford it. I am very disappointed that Congressional Leadership has chosen to convene Congress less than half of the working days this year, rather than working out the details of a grand bargain based on shared sacrifice.  ItÛªs clear that Americans are fed up with the partisan gridlock and governing by crisis and so am I.  ItÛªs time for Congress to come together and take action to replace these potentially devastating cuts with a responsible and balanced alternative.",Democrat
279006440801_10152830470185802,"The U.S. Census Bureau is looking for a considerable amount of field representatives in Cuyahoga, Geauga, Lake, Lorain and Medina Counties for the 2015 American Housing Survey.  These positions require the Census representative to travel door-to-door to interview people at their homes. The information collected from the survey is used at every level of government and private organizations to make decisions based on housing and population trends. Interested applicants must have a valid driverÛªs license and an insured automobile. Call 1-800-563-6499 for more details and to apply.",Democrat
279006440801_10152475786615802,"Please join me in the celebration of May as Jewish American Heritage Month.  I am proud to serve Ohio's largest Jewish community and recognize the many contributions of its people.   The values of tzedakah and tikkun olam that have guided the community through the centuries are widely evident today through the commitment of so many our valued friends and neighbors to promote justice, dignity and an improved quality of life for all people.",Democrat
279006440801_10152263830995802,"Today we celebrate the life and legacy of civil rights leader Dr. Martin Luther King Jr.  His dream was for every individual to have an equal and uninhibited access to the American Dream, which we are still fighting for today.",Democrat
279006440801_10152143694270802,"Pending ""stand your ground"" legislation in Ohio eliminates a current law requiring retreat before using deadly force.  This provision has the potential to increase gun violence for many people, regardless of race, and also negatively impact Ohioans subjected to racial profiling.  Insensitive and reckless acts of prejudice should not be supported by laws encouraging violence.  That is why I sent a letter to Attorney General Eric Holder requesting that the Department of Justice collect additional information on the racial disparities of ""stand your ground"" laws in communities across the country  before another unwarranted death occurs.",Democrat
279006440801_10152026845460802,"Hearts are heavy in Northeast Ohio as we grieve a fallen soldier.   Army Specialist Angel Lopez was a mechanic in Afghanistan who lost his life due to injuries sustained from an attack on his unit.   AngelÛªs family said he was a good person who loved his family. He graduated from John Marshall High School and leaves behind a wife and two young kids.   The government shutdown impeded AngelÛªs wife ability to receive his last paycheck. But fortunately, the House and Senate recently passed H.J.Res. 91, a funding bill to allow the Pentagon to pay military death benefits despite the government shutdown.  Now AngelÛªs family no longer has to worry about costs such as his burial expense.  At least 2,146 members of the U.S. military, 132 this year alone, have died due to the Afghanistan conflict. This 12-year-old war has resulted in far too many casualties and I look forward to the day when all of our troops can be safely brought home.    My thoughts and prayers are with the Lopez family.",Democrat
279006440801_10151976328570802,"Happening now-at news conf. w. Chef Tom Colicchio, Dem. Leader Pelosi and others: Don't slash $40 billion from SNAP . http://t.co/QCqT9WmSCy",Democrat
279006440801_10151833313515802,Republicans said today taking SNAP out of the farm bill is getting rid of something #extraneous.Tell that to 47 million hungry Americans,Democrat
279006440801_399198930177732,We are not doing enough to address poverty in our nation and trickle down economics will not break the cycle. I shared my views in an interview that appears today on the Huffington Post Website. http://www.huffingtonpost.com/2013/04/08/congress-poverty_n_3000459.html,Democrat
279006440801_10151545423735802,Thanks to @WomenUnitedFor  I was proud to be at your forum on gun violence prevention. We cannot afford to be silent.  #WU4,Democrat
189998554345168_838948506116833,"In light of the influx of unaccompanied children crossing our nationÛªs border, I, along with my Tennessee colleagues, wrote a letter to President Obama demanding answers about the number, status, and location of these children. This is of the utmost importance, and I will not stop fighting until we receive the truth.",Republican
189998554345168_804147969596887,"Congratulations to Deseree Horseson for winning the Third DistrictÛªs Congressional Art Competition. DesereeÛªs piece, Tennessee Calling, will be displayed in the Capitol for the next year. Great work Deseree!",Republican
146176682102245_793196834066890,ICYMI: My weekly interview with News Talk 1620 WTAW,Republican
146176682102245_789835674403006,"Even though the CRomnibus bill passed despite my NO vote, the bill has a lot of things for conservatives to like, and it gives us additional chances early next year to stop the presidentÛªs unlawful amnesty policy.",Republican
146176682102245_707906452595929,World War I began one hundred years ago today. We honor those who served and lives lost in the Great War.,Republican
146176682102245_695117060541535,"It was great seeing you, Ryan Davenport. Thank you for dropping by my office!",Republican
146176682102245_693114754075099,"President Obama swore an oath to preserve, protect and defend the Constitution. Legislation will soon be presented that authorizes the House to file a suit to compel Obama to follow his oath of office. Speaker Boehner explains why the president needs to be sued:",Republican
146176682102245_683738971679344,"The President promised to work ""hand-in-hand"" with Congress to fix IRS targeting. We are waiting:",Republican
146176682102245_683706548349253,Did you know that the IRS is actually required by federal law to print out hard copies of emails? There is no excuse for losing Lois LernerÛªs emails.,Republican
146176682102245_669164713136770,"As Chairman of the VeteransÛª Affairs Subcommittee on Economic Opportunity, I held a hearing to explore jobs for veterans in the energy sector. We discussed how to match unemployed veterans to our opportunities in the energy industry, which is experiencing rapid growth.",Republican
146176682102245_668735796512995,I will be chairing a VeteransÛª Affairs Economic Opportunity Subcommittee hearing exploring jobs for veterans in the energy sector. Watch live at 1:00 CST:,Republican
146176682102245_668310153222226,"This week, the House will take up legislation to combat human trafficking. My latest op-ed touches on the efforts to stop this awful scourge on our society:",Republican
146176682102245_663074383745803,"With the establishment of the select committee on Benghazi, we can work to reveal all of the facts of what happened, how it could have been avoided, what can be done to prevent this from happening again and who made the decisions to not help our American personnel when they were under attack. ",Republican
146176682102245_662948410425067,"Today is VE Day. On this day in 1945, the U.S. and our allies achieved victory over Germany, ending World War II in Europe. Thank you to all of our World War II veterans and to all of those who continue to fight for our nation today.",Republican
146176682102245_651657211554187,Today marks the anniversary of the Boston Marathon bombing. Please join me in taking a moment to remember the lives lost and to honor the survivors. Follow live updates on the one-year anniversary here:,Republican
146176682102245_646664152053493,Honored to be named an ACU Conservative by the The American Conservative Union.,Republican
146176682102245_10201739205786844,I will be talking to News Talk 1620 WTAW's Scott DeLucia in a few minutes to give my weekly Washington update. Tune in or listen online at: http://wtaw.com/,Republican
146176682102245_618655501521025,Please join me in wishing Senator John Cornyn a Happy Birthday!,Republican
146176682102245_607082179345024,The House continues to pass job bills that would better our economy and the lives of the American people. It is time for Senator Harry Reid to allow the Senate to vote on them and for the president to realize America needs job creation.,Republican
146176682102245_567824239937485,ICYMI: My weekly interview with News Talk 1620 WTAW.,Republican
146176682102245_554257637960812,I will be talking to KWTX News 10 in a few minutes to give my monthly Washington update. Tune in on your T.V. or watch it online:,Republican
146176682102245_537407989645777,"Robby, Kayley, and Brandon Smith, Lloyd, Vivki, Chantale, Andy, Carley, and Taylor Deuel from College Station, TX.",Republican
146176682102245_501744473212129,"Mandie and Jason James from Bryan, TX.",Republican
146176682102245_489093561143887,"Kelley Cummins from College Station, TX.",Republican
138220153003017_285777274913970,"Today is Equal Pay Day. If you, or a loved one, has been affected by this issue share your story with us.   http://frankel.house.gov/tell-us-your-story",Democrat
138220153003017_284310745060623,I spoke today on the House floor about the ever-growing need for Alzheimer's research and awareness.  Someone is diagnosed with this horrible disease almost every minute - this has to stop. ,Democrat
138220153003017_2782511638333,Attention High School Students: Do you have a good idea for a mobile app? Enter the Congressional App Challenge now. Click below for more information ,Democrat
138220153003017_204496236375408,Check out how Florida hopes to combat identity fraud and save about $60 million a year in benefits it would have paid to fraudsters.,Democrat
138220153003017_187992801359085,"Days after returning from meeting with American troops and military leaders in Afghanistan, Qatar, Germany and Kosovo, I helped pass a bipartisan bill to support our troops and veterans. This bill also includes several important provisions to help eliminate the veterans disability claims backlog.",Democrat
6459789414_10152974599959415,Attn. Veterans: Salem VA Medical Center will host a town hall listening session on Monday at 3PM in the Auditorium. This is a good opportunity for veterans and family members to voice any concerns or ask questions about service at the facility.,Republican
6459789414_10152966171579415,Maryellen and I had a great time at the James Madison University homecoming game today! The Dukes rallied for a win. Go Dukes!,Republican
6459789414_10152863519979415,"I welcome the news that Eric Holder will step down as Attorney General. From Operation Fast and Furious to his misleading testimony before the House Judiciary Committee regarding the DepartmentÛªs dealings with members of the media and his refusal to appoint a special counsel to investigate the IRSÛª targeting of conservative groups, Mr. Holder has consistently played partisan politics with many of the important issues facing the Justice Department. I hope that the next Attorney General will take seriously his role as the nationÛªs top law enforcement officer, working with Congress to ensure that the laws of our land are followed instead of being a roadblock on the path to justice.",Republican
6459789414_10152717252589415,"Update: The Unlocking Consumer Choice and Wireless Competition Act (cell phone unlocking bill) has been signed into law! Good to see this pro-consumer, pro-competition legislation become law. More info on it here: http://goo.gl/8JWMtg",Republican
6459789414_10152604458539415,"The President's plan to deal with his self-made border crisis is smoke and mirrors. If President Obama really wants to fix this problem, he should implement real solutions, such as enforcing our immigration laws and reversing his policies that created this mess in the first place.",Republican
6459789414_10152481299159415,Great to meet with some Virginia members of ACEC National (American Council of Engineering Companies) today. Thanks for stopping by to talk transportation and taxes.,Republican
6459789414_10102390409427203,Congratulations to the Town of Broadway on being named the safest city in Virginia! #VA06,Republican
6459789414_10152119865304415,"From my family to yours, Happy Thanksgiving! I hope your day is blessed with friends and family. My thoughts are also with those who are not able to be home for the holidays, and I thank them for their service to our nation.",Republican
6459789414_10151681520574415,There are some major discrepancies between Attorney General Holder's testimony before the U.S. House Judiciary Committee and the Dept. of JusticeÛªs decision to obtain a search warrant for the emails of the chief Washington correspondent for Fox News. It is imperative that AG Holder explain these actions and provide a full and accurate account of his involvement.,Republican
6459789414_587339527960812,"In light of the recent report by the State Dept., after months of stalling, it's time for the White House to approve the Keystone XL pipeline. We can harness North American energy sources to help create jobs here in the U.S.",Republican
6459789414_10151455238864415,Sixth District Stops,Republican
49640749719_10151832665469720,Police have identified Aaron Alexis ÛÒ who has ties to Fort Worth ÛÒ as the shooting suspect in yesterdayÛªs Navy Yard massacre.  Authorities are asking that anyone with information on the suspect contact the FBIÛªs Washington Field Office at (202) 278-2000 or 1-800-CALL-FBI (1-800-225-5324). #NavyYardShooting,Republican
49640749719_10151595546439720,"I just voted to move the construction of the Keystone Pipeline forward.  What a great effort by Republicans and Democrats to come together to support job creation and energy security.  Now, itÛªs in the SenateÛªs hands.  I urge them to take up and pass this bill quickly.  Tens of thousands of American jobs rely on it.",Republican
49640749719_10151584869884720,"I had a great visit with my friend Tim Smith, Fort Worth President of International Association of Machinist and Aerospace Workers (IAM).  Tim also introduced me to some of his colleagues in the flight attendants union who raised their concerns about TSA's decision to allow knives on planes.",Republican
49640749719_10151583588539720,"It was great to meet with board members of the Mental Health Connection of Tarrant County while they were in Washington, DC.  Access to mental health services are vital to the health of any community.  You can learn more about the great work the Mental Health Connection is doing here: http://www.mentalhealthconnection.org/",Republican
49640749719_10151424761749720,"Yesterday I was pleased to meet with Tarrant County College Vice Chancellor Reginald Gates, Chancellor Erma Johnson Hadley, and Members of the Tarrant County College Board of Trustees.  They updated me on the great work that is being done at Tarrant County College campuses.  We also discussed the importance of the Pell Grant program for helping students obtain higher education.",Republican
128735131872_10152239396696873,"The Congressional Budget Office (CBO) recently released a report, which included the economic impacts of the Affordable Care Act (ACA). Many have mischaracterized the report, claiming that the ACA will directly cost the American economy upwards of two million jobs. The report actually states, and CBO director Douglas Elmendorf confirmed yesterday before the House Budget Committee, that the ACA will reduce the total number of hours worked across the economy by an amount equivalent to about 2 million full-time workers over the next 10 years. These estimates reflect workers, not jobs. The ACA will actually give workers the freedom to work less because they will no longer need to work longer hours or remain trapped in their jobs to hold on to affordable health insurance.",Democrat
128735131872_10152197639071873,"On Monday, our nation will celebrate the life and achievements of a true American hero, Dr. Martin Luther King Jr. He was committed to achieving equality for all and ending racial segregation, fighting tirelessly. Dr. King exemplified the qualities of a real leader.",Democrat
136237609724391_904649162883228,Peaceful protest is the best protest.,Democrat
136237609724391_10101419812865435,"Today, I spoke about the courage it took to launch the War on Poverty and how that courage is needed now to ""Raise the Wage"":http://www.youtube.com/watch?v=XBuPUHyTnD0&feature=youtu.be",Democrat
136237609724391_744878312193648,"Today, I spoke about the special relationship between the Philippines and the US, and our aid efforts to assist them through this tragedy: http://tinyurl.com/mel7g7d",Democrat
136237609724391_613052702042877,Join me and Rep. Luis Gutierrez today at 12:00pm at the Bayou City Event Center for a Town Hall meeting on Comprehensive Immigration Reform.,Democrat
182567716746_10152448503811747,"If someone in your life is looking for a job (or a better job), my office is helping out at a job fair happening tomorrow in #YubaCity. Bring your resume, dress for success, and practice your short interview speech.",Democrat
182567716746_10152158584356747,An Amber Alert has been issued for a baby abducted in Northern California. Keep an eye out.,Democrat
182567716746_10152080827921747,Today The Davis Enterprise Newspaper published my op-ed on #Syria in response to a column published by the paper a couple weeks ago. There are a lot of good questions about the wisdom of a potential strike in Syria and a lot of disconcerting answers.,Democrat
182567716746_10151978466416747,"Today is the 60th anniversary of the Korean War Armistice. We owe enormous gratitude to those who served and fought communist aggression. If you know a #KoreanWar veteran, post a photo in their honor ÛÒ itÛªs a small but meaningful gesture to bring attention to this ÛÏforgotten war.Û
 
 My office caseworker Brandon Thompson is working with Harold Griffith, a Korean War veteran in Yuba City, to try and help him receive his VA benefits. Read about Mr. Griffith's experiences in this Appeal-Democrat article: http://bit.ly/11kl4CP .
 
 If you or someone you know lives in the 3rd District and encounters difficulty with VA or other federal benefits, please call my district offices during the week and ask for a constituent caseworker. The phone number for my Davis office is 530-753-5301, Yuba City's is 530-329-8865, and Fairfield's is 707-438-1822 . Not sure if you're a resident of the 3rd District, go to http://www.house.gov/representatives/find/ to find out.",Democrat
182567716746_10151882968471747,"Today, the U.S. Department of Veterans Affairs and U.S. Department of Housing and Urban Development announced that they will provide housing for 9,000 currently homeless veterans. This is good news and more progress in the goal of completely ending homelessness among veterans, which has declined by 17 percent since 2009.  My office is committed to helping veterans get the support they have earned. If you or someone you know live in the District and need help obtaining your VA benefits, please call my caseworkers at 530-753-5301",Democrat
182567716746_350834378350612,"At 10:05 AM PT/ 1:05 PM PT, you can listen to my conversation with The Ed Schultz Show about the #1 issue in Northern California and in America today: jobs. Listen to the radio program through this link:",Democrat
182567716746_10151729165061747,"STAFF: While Congressman John Garamendi is on the floor watching the State of the Union, we will live tweet some of our favorite moments on Twitter at http://www.twitter.com/repgaramendi.",Democrat
182567716746_10151728705981747,"Thank you to all participants in SaturdayÛªs terrific town halls in the City of Woodland & Marysville. These events help me gauge the pulse of the district and determine what issues and policies I should be advancing in Washington (more on the town halls here: http://1.usa.gov/X5xN6X ). Stay in touch with our offices and look for more district events, including those on March 9th, by going to my website www.garamendi.house.gov
 FYI The Woodland Daily Democrat Appeal-Democrat",Democrat
182567716746_10151680320206747,"Reminder for Davis & Yolo county residents: Starting at 3 PM today, meet my staff, members of our community, and me at the grand opening of our new Davis Office. Learn about how my team can help you! The office address is 412 G St, Davis, CA and the event lasts until 6 PM. More event details here: http://on.fb.me/WX1YMG Davis Patch UC Davis The California Aggie The Davis Enterprise Newspaper",Democrat
104548906262119_853490154701320,"I just voted for and the House passed H.R. 5759, a bill to stop President ObamaÛªs executive amnesty plan and prevent any similar actions in the future.   The House has acted on behalf of the American people to stop President ObamaÛªs lawless action and preserve our constitutional checks and balances. This is one positive step in what will be a broad effort to shut down the presidentÛªs plan. I am very encouraged by the lawsuit filed yesterday by seventeen states, including Georgia. The incoming Senate Republican Majority will soon work with the House to block executive amnesty. Conservative senators have already promised to use their unique powers, such as the ability to block presidential appointments. Until the presidentÛªs last day in office, we must continue fighting to uphold the law and restore balance to our government.",Republican
104548906262119_786580541392282,Thanks to Kendra from Dallas and the Stewarts from Duluth for visiting the office today. #Georgia,Republican
104548906262119_722524334464570,"I also toured Ball Corporation's Rome plant, the Metal Beverage Packaging Division. This is a very impressive operation, and we're proud to have them in the 14th Congressional District.",Republican
104548906262119_655688844481453,"Another holiday, another #Obamacare delay. Makes you wonder what President Obama will do for Christmas http://www.politico.com/story/2013/11/online-shop-enrollment-delayed-by-one-year-100438.html",Republican
104548906262119_624857624231242,I'll be on Fox News at 1pm today to talk about our efforts to keep the government open and get Harry Reid to do his job and negotiate. #LetsTalk,Republican
104548906262119_617445101639161,Be sure to watch ABC's This Week this morning to see a great segment on our efforts to keep the government open and protect working Americans from #Obamacare. Find your local show times at this link: http://abcnews.go.com/ThisWeek/,Republican
104548906262119_529254343791571,"On March 26, I'm hosting a Small Business Outreach Seminar in Dallas, GA. If your small businesses needs help utilizing federal resources or you need to learn about competing for federal contracts, this seminar will be very helpful. This is free and open to the public - details here: http://tomgraves.house.gov/news/documentquery.aspx?DocumentTypeID=2000",Republican
191159267565100_951264958221190,"While wages stay stagnant, every day costs are on the rise. What is costing you and your family the most?",Republican
191159267565100_933812629966423,"Today, we reflect and remember those who died on September 11th. We must also thank those who protect us at home and abroad every day. We will never forget the brave Americans we lost and their acts of courage on that day will continue to make us all proud to be Americans.",Republican
191159267565100_885496721464681,Join Rep. Larry Bucshon and I on Wednesday at 2:00pm at the Transportation and Infrastructure Committee Facebook page for a LIVE question and answer session on our experience in the #driverless car.,Republican
191159267565100_839484072732613,Did you know that tax compliance costs are 65 percent higher for small businesses than for big businesses? Like if you are ready for real reforms to the tax code.,Republican
191159267565100_694484843899204,Thank you to everyone who came out tonight in Hartville. It was great hearing what was on your mind and answering your questions.,Republican
191159267565100_679869155360773,What are your thoughts on the delay concerning the Employer Mandate in Obamacare?,Republican
191159267565100_666464996701189,An old one of me and my kids. Happy Father's Day to all of the Dads out there today.,Republican
191159267565100_641927442488278,The Department of Veterans Services is now accepting nominations for the Ohio Veterans Hall of Fame.  Be sure to submit your nomination by June 30th.  http://bit.ly/YgOPVZ,Republican
191159267565100_637044062976616,"A member of my staff will be holding office hours today from 12pm-2pm in Knox County.  Mt. Vernon Library 201 N. Mulberry St. Mt. Vernon, OH 43050",Republican
