Id,Text,Party
148299805224565_562236227164252,"ONCE UPON A TIME, the GOP changed a House Rule to guarantee a government shutdown, (http://talkingpointsmemo.com/dc/the-house-gop-s-little-rule-change-that-guaranteed-a-shutdown), fulfilling a plan months in the making.(http://www.nytimes.com/2013/10/06/us/a-federal-budget-crisis-months-in-the-planning.html?pagewanted=all)  This plan was the culmination of some 40+ votes to defund or delay the Affordable Care Act, which GOP members and leadership continually stuck to as their reason for not budging during the first days of the shutdown(http://articles.washingtonpost.com/2013-10-04/politics/42692181_1_funds-government-operations-government-shutdown-debt-ceiling), despite the fact the healthcare exchanges went into effect October 1st anyway.  That is, that WAS the argument, until it was clear they weren't getting anywhere, and instead, the GOP argument started to center on the debt ceiling.(http://www.politico.com/story/2013/10/republicans-gop-obamacare-government-shutdown-debt-ceiling-98102.html).  Meanwhile, on the ""left"" side of the Chamber,  Democratic members continually tried to bring to the floor a vote on a ""clean"" budget as a compromise to reopen government. This budget - at/below GOP-proposed levels passed by the Senate earlier this year, had the professed bipartisan support of a majority of the House, ((http://www.washingtonpost.com/blogs/post-politics/wp/2013/10/06/majority-of-house-appears-to-support-clean-cr/) but GOP leadership refused to bring it to the floor, and maneuvered to block any member who tried raising it.   Then, the GOP agreed to raise the debt ceiling, but not open the government, as their ""compromise,""(http://www.cnn.com/2013/10/10/politics/shutdown-showdown/index.html?utm_source=feedburner&utm_medium=feed&utm_campaign=Feed%3A+rss%2Fcnn_allpolitics+(RSS%3A+Politics))....but only if it was a 6 week debt ceiling agreement...and only if was tied to conversations about how to fix our long term deficit...and only if those conversations were about cuts, and not revenues.(http://www.huffingtonpost.com/bob-greenstein/while-government-remains_b_4066052.html)   And then, they called that tactic moving ""halfway."" (http://www.slate.com/blogs/weigel/2013/10/10/boehner_we_re_meeting_halfway_on_what_obama_wants.html).  What's next? Who knows what the GOP will do.  But make no mistake: People across this country- children(http://www.huffingtonpost.com/2013/10/10/government-shutdown-wic_n_4073146.html), military families(http://www.cbsnews.com/8301-250_162-57606695/government-shutdown-hitting-veterans-military-families-hard/), seniors(http://abc10up.com/govt-shutdown-stops-food-delivery-seniors/), and many more are being hurt by this shutdown....with more to be impacted the longer this goes on. (http://thinkprogress.org/economy/2013/10/10/2761511/food-stamps-automatic-cuts/).  This is a manufactured politically motivated crisis that never had to start, and could end tonight if the GOP leadership would just let us vote on a clean budget. Let's truly make this a ""once upon a time"" story, and end this shutdown. #DemandAVote",Democrat
153386471383393_754356301286404,"The Ebola virus is a serious international threat to public health that must be contained and extinguished in West Africa.  This requires a global response, including the on-going commitment by U.S. civilian and military personnel. For this crucial humanitarian relief mission, it is no surprise that the Pentagon is calling on MinnesotaÛªs Red Bulls with their proven record of expertise, skill, and resourcefulness.  While they will not be treating patients, their mission is vital to containing this virus in Africa and ultimately saving lives.   As with any mission, the health and safety of our soldiers are my highest priorities. I have been working with the U.S. Department of Defense for months to ensure that U.S. troops are trained and ready to assist in this important work, and that extra steps are being taken to protect their health, including providing personal protective equipment and training about the disease.  I will also work to ensure our soldiers receive the compensation and benefits they deserve during this deployment.  The citizen-soldiers of the Red Bull 34th Infantry Division Headquarters are leaders of the highest caliber, having been called on combat missions in Iraq and Afghanistan and peacekeeping missions in Kosovo and Bosnia. With this deployment to Liberia, our Minnesota Red Bulls will once again have the support and gratitude of the American people.  I wish our troops much success in this important humanitarian mission and their families have my full support.",Democrat
153386471383393_675736709148364,"I got the chance to tour Acadia National Park in Maine today with some of their park rangers.  Acadia gets over 2.2 million visitors a year, and is one of the busiest parks in the country.  I love visiting our National Parks and learning about how we can keep them working for America.",Democrat
153386471383393_10100194144674712,"Today, I spoke on the House floor urging GOP leadership to extend unemployment benefits.    http://mccollum.house.gov/video/congresswoman-mccollum-urges-house-republicans-extend-unemployment-benefits",Democrat
153386471383393_527007390687964,"It's time to pass comprehensive immigration reform that will best serve the needs of our families, businesses, workers, and communities!",Democrat
153386471383393_481299125258791,"Proud to sign onto a letter this week to the Secretary of Defense, Chuck Hagel, urging him to immediately reinstate all suspended Department of Defense tuition assistance programs.  Our service members voluntarily defend our nation and rely on the support of these benefits for professional and personal growth.",Democrat
153386471383393_480875081967862,"Today I voted NO along with every House Democrat, on the GOP-Ryan Budget, which is a disastrous for our economy, our families, and the future of our country. Imagine this:  if the GOP budget actually became law, it would result in 2 million lost jobs in 2014 alone (according to the Economic Policy Institute).   Instead of common sense investments, such as growing the economy, creating jobs, and strengthening our families, this Republican budget is harmful.  It lowers taxes on the wealthiest Americans, while 66% of the non-defense budget cuts come from programs helping low or moderate income families.  The GOP cuts and guts $3.7 trillion over the next decade from programs like Pell Grants for college students, job training for dislocated workers, nutrition programs for poor children, and healthcare for our most vulnerable citizens.   Congress needs to move forward with a balanced approach to address deficit reduction ÛÒ increased revenues, elimination of special interest tax breaks, smart cuts to failing programs, and investments in growing the economy.",Democrat
8045519803_10152605788964804,"Giulia and my thoughts and prayers are with all those impacted by the current Ebola outbreak in West Africa specifically Samaritan's Purse volunteers Kent Brantley and Nancy Writebol, a Charlotte resident.  Please join us in praying for all those infected by this horrific virus and thanking the brave volunteers, like those from Samaritan's Purse, fighting to stop this outbreak.   http://www.citizen-times.com/story/news/local/2014/07/28/weary-samaritans-team-front-lines-ebola-crises/13292195/?utm_source=twitterfeed&utm_medium=twitter ",Republican
8045519803_10152435289814804,Very sad to hear of the passing of former Hickory Mayor Bill McDonald.  Bill was a cheerful and positive man who served the city honorably and effectively for 20 years.  He was a true gentleman and will be missed by all.   http://www.hickoryrecord.com/news/former-mayor-bill-mcdonald-s-legacy-all-steps-forward-for/article_290d0a6e-d893-11e3-8db9-0017a43b2370.html ,Republican
8045519803_10151897950569804,"Today we come together as Americans to honor those who lost their lives on September 11, 2001 and to remember the brave men and women who made the ultimate sacrifice defending our nation in the 12 years since that horrible day.  God Bless America.",Republican
8045519803_10151729114729804,Yesterday I presented the Congressional Award Gold Medal to Wilmoth Kerns III of Gastonia and Lukas Stewart of Bessemer City.  These two young men did over 400 hours of community service and 200 hours of both personal development and physical fitness activities to earn this award.  Keep up the great work guys!,Republican
8045519803_10151617276874804,"Last night we lost ""America's Most Beloved Gospel Singer,"" George Beverly Shea, of Montreat after a brief illness. Working with Reverend Billy Graham, Bev spread the Gospel to every continent and state of the Union. He'll be missed but remembered through his music and the kindness that he showed so many around the world.",Republican
8045519803_10151462207244804,"The ribbon cutting & grand opening of Congressman McHenry's Black Mountain Regional Office.  The Congressman was joined by Black Mountain Mayor Carl Bartlett and the Town Board as well as Mayors from across Buncombe County and County Commissioner Chairman David Gantt and Commissioners Mike Fryar, Ellen Frost and Joe Belcher.",Republican
6355254859_10151998763329860,I was on NBC Nightly News tonight discussing TSA's Behavioral Detection Program.  Check out the video below.,Republican
6355254859_10151941518939860,"On Monday I was lucky enough to participate in and speak at a ""Helping a Hero"" groundbreaking event on a new home for a wounded warrior in Cypress, TX.    We have a duty to fulfill President Lincoln's promise to "" care for him who shall have borne the battle, and for his widow, and his orphan.Û  Helping a Hero is doing this each and every day and I am humbled every time I am able to be at one of these events.",Republican
6355254859_10151843276209860,Retweeted RepKevinBrady (@RepKevinBrady):  CIA Director Pledges to Make Benghazi Survivors Available to Talk http://t.co/DxEbwrLg58,Republican
6349487899_10152126284877900,"I just voted to pass the Sportsmen's Heritage and Recreational Enhancement Act, a bill I cosponsored which would guard against overreaching regulations that limit access to hunting and fishing. For many Texans, myself included, these are not just recreational activities ÛÒ they are long-standing family traditions.",Republican
6349487899_10151826521427900,Every family has to live within its means and overcome differences. Congress must do the same. I spoke today on the House floor to express these views and call for fairness for all Americans.,Republican
6349487899_10151497330232900,"As part of my officeÛªs Veterans History Project, my staff sat down and interviewed US Navy Petty Officer Barton Dale Messler of Irving. Mr. Messler is one of an estimated 3,000 Pearl Harbor survivors that are still alive to share their stories from that infamous day. During his interview, Mr. Messler recounted his experience as a Gunners Mate on the USS Pennsylvania on December 7, 1941, as well as many other stories from throughout his impressive military career. Click the link below to watch:",Republican
6349487899_10151475926592900,"The latest jobs report was a severe disappointment for millions of Americans struggling in our economy. Only 88,000 jobs were added last month, according to the Department of Labor, and nearly half a million people left the job market, bringing down the percentage of Americans in the labor force to its lowest level since 1979. This helped tick down the official unemployment rate to 7.6 percent, but for all the wrong reasons: for every job gained last month, more than five people stopped looking for work altogether. This is unacceptable. America needs real jobs, real solutions, and real results.",Republican
6349487899_10151434364052900,"It was great to get a visit from Jacob Martinez, a 5th grader from Grapevine, in my Washington office this afternoon. I am glad he is making the most of his Spring Break by travelling to Washington and meeting with his elected representatives.",Republican
6349487899_10151434051972900,"I was happy to see Governor Rick Perry at our weekly Texas Republican Delegation lunch in Washington today. During our meeting, we discussed his support for the Medicaid block grants that are included in the House Republican budget, and he assured us that Texas will not participate in the Obamacare exchange program.",Republican
6349487899_414310685328752,"I am pleased to have been selected to Chair the Tax Reform Working Group on Debt, Equity and Capital. The American tax code is outdated and overly complicated. We need to move forward with real tax reform that lowers rates, closes loopholes, and helps strengthen our economy. I look forward to working with my colleagues to explore ways to achieve comprehensive tax reform in 2013.",Republican
58864029545_10153402640579546,"Open enrollment starts today! If you have questions or require assistance, contact the Marketplace call center. You can find contact information below. Open enrollment ends December 15. If you enroll by December 15, you'll be covered starting January 1, 2015. Time to get covered!",Democrat
58864029545_10151927760384546,Today I voted against the Pay China First Act. Like and share if you think we should prevent self-inflicted damage to our economy.,Democrat
58864029545_522626757787851,Learn more about Passport Day below!  ,Democrat
58864029545_10151746756189546,The President's State of the Union is tonight! What topics do you want him to emphasize? Vote here! ,Democrat
58864029545_530509086970964,"Today is the start of Black History Month! Let us reflect on this year's theme, ""At the Crossroads of Freedom & Equality: The Emancipation Proclamation & the March on Washington.""  Also, be sure to follow me on Twitter to receive daily Black History Month facts! https://twitter.com/RepGwenMoore",Democrat
58864029545_207845766026296,Check out my first e-newsletter of the 113th Congress!,Democrat
51052893175_10152501108093176,"California's #water crisis cannot go unanswered, and the HouseÛªs unwavering commitment to find a solution has led to the California Emergency Drought Relief Act, introduced by Congressman David G. Valadao. Due to the urgent nature of the water crisis, the House will vote on this legislation next week.",Republican
51052893175_10152355819518176,"Yesterday, Ukrainian President Petro PoroshenkoÛªs addressed a joint session of Congress. I commend him for the passion & determination he has shown guiding #Ukraine on what remains a difficult path to restore the territorial integrity of his country. Now, America must stand with Ukraine in defense of freedom in the world.",Republican
51052893175_10152267733373176,Today marks 224 years of exceptional service by the men and women of AmericaÛªs #CoastGuard. Thank them by 'liking' and 'sharing'.,Republican
51052893175_10151574655668176,"Bakersfield Observed - McCarthy: small businesses struggle under the weight of over regulation, and the work going on to find a cure for Valley Fever",Republican
51052893175_10151534362483176,"Today in history in 1969, Neil Armstrong became the first person to walk on the moon.",Republican
51052893175_10151446009153176,Today I talked to Scott Cox about the unacceptable backlog facing our veterans at the VA and the importance of working towards a Valley Fever vaccine. I will not stop fighting in Congress until these goals are met - period. http://bit.ly/141aKk7,Republican
51052893175_10151417207173176,Good luck to the Rocketry Team from St. AnneÛªs School in Porterville who will be competing in the National Finals of the Team America Rocketry Challenge tomorrow! Thanks for coming by the office yesterday. WeÛªre proud of you all!,Republican
51052893175_10151381676653176,"This morning, I joined veterans service organizations leaders and VeteransÛª Affairs Committee Chairman Miller and Committee Members to discuss legislative priorities for veterans in the 113th Congress as well as our continued efforts to hold the Department of Veterans Affairs accountable for the unacceptable backlogs at VA centers across the country. Our veterans deserve better.",Republican
215241308510238_859245067443189,"I have been meeting with our local hospital officials this week, including those from San Joaquin General Hospital, St. Joseph's Medical Center, Lodi Health, and Kaiser Health, and I am very pleased and proud of the work they are doing to be ready if any Ebola cases occur in our area. I told them I would make sure the CDC and federal government supports their efforts.  I will continue to press the administration and the CDC to do everything necessary to prevent the disease from reaching our shores again, and to make sure our health care workers have access to the appropriate equipment and most accurate guidance on preventing transmission of the disease.",Democrat
215241308510238_10152189816348876,IÛªm excited to welcome Google Barge to the Port of Stockton. Our region has tremendous resources and I know Google will find its stay in Stockton rewarding. Read more about Google barge here: http://bit.ly/1cRrADJ and take a look at my letter to Google CEO Larry Page welcoming their company to our community http://1.usa.gov/1kK327F. ,Democrat
215241308510238_648674438500254,Want to know how the government shut down might affect you?  The Record has a good breakdown:,Democrat
215241308510238_631503213550710,Touring the Head Start of San Joaquin Facility in Stockton and meeting with the faculty who are dedicated to ensuring that all children are given the tools they need to succeed in their future goals.,Democrat
144408762280226_674455989275498,"4 years since ÛÏRecovery SummerÛ & here is reason #9 Senate Democrats to act on the 40 House-passed jobs bills: Far more adults have left the workforce than found new jobs. Under the Obama Administration, the ratio of adults in their early and prime working years that have left the workforce for every one that found new employment is more than 3:1.",Republican
144408762280226_502428926478206,"ATTENTION VETERANS & FAMILIES:  Next Tuesday (June 18), staff at my Hamlin Constituent Service Center will be teaming up with DAV (Disabled American Veterans) to host mobile office hours for local veterans and their families seeking assistance in obtaining benefits and services through the VA.  DAV's Mobile Service Office will be parked in the lot outside of our Hamlin Constituent Service Center from 9:00 a.m. to 4:00 p.m.  No registration necessary.  Click below for more information...",Republican
130377260362609_756167137783615,Foundations and private industry are coming together for a $20 million Appalachia Partnership Initiative to educate and train West Virginia students to work in growing regional energy and manufacturing industries.,Republican
130377260362609_739491856117810,What a great way to help local businesses.,Republican
130377260362609_735014743232188,"Our thoughts and prayers are with Gov. Moore, Rep. Capito and their entire family today. Mrs. Moore will be deeply missed. ",Republican
130377260362609_718699388197057,"After conducting a Philanthropy Roundtable in Ohio County, Rep. McKinley tours the new ""Grow Ohio Valley"" site on Wheeling Island.  During the roundtable, participants discussed key federal issues impacting our state's grantmaking foundations and nonprofits.  ""Grow Ohio Valley"" is an example of a public-private-philanthropic partnership.",Republican
130377260362609_666012390132424,"Rep. McKinley poses with Boy Scouts from Troop 6 in Wheeling, W.Va.",Republican
130377260362609_612943125439351,"Rep. McKinley votes for fair, bipartisan government funding bill   funding bill.  Washington, D.C.ÛÓToday, Rep. David B. McKinley (R-WV) voted for the Consolidated Appropriations Act of 2014 (H.R. 3547) which funds the Federal Government through the end of September 2014.  ÛÏThis is not a perfect bill but itÛªs good for rural America and avoids another government shutdown,Û said Rep. McKinley.  ÛÏSpending is lower than when President Obama took office so weÛªre making progress, but thereÛªs still a lot more to be done.Û  ÛÏAdopting a budget for the first time since the President took office puts spending priorities back in the control of Congress rather than at the discretion of the President,Û added McKinley. ÛÏCongress can now focus on rooting out government waste and abuse and meet our priority of cutting the deficit.Û  Some of the Highlights of the Funding Bill Benefitting the First District:  Û¢No new funding for Obamacare (Affordable Care Act); reduces ÛÏslush fundsÛ by $1 billion; and cuts $10 billion in funding for the Independent Payment Advisory Board (IPAB) created by Obamacare. Û¢Provides an additional $132 million for fossil fuel research and development at the National Energy Technology Laboratory (NETL) in Morgantown. Û¢Reduces EPA funding by $2.1 billion by scaling back regulatory overreach while enhancing oversight on climate change programs and the mining permit process. Û¢Includes a military retiree pension ÛÏfixÛ to ensure disabled veterans and surviving families receive the full benefits they are due. Û¢Increases funding for the Appalachian Regional Commission (ARC) by $12 million. Û¢Provides over $3 billion for the Community Development Block Grant Program (CDBG). Û¢Prevents the Export-Import Bank and the Overseas Private Investment Corp. from prohibiting funding for international coal plant projects.  ÛÏAfter voting against the budget proposal in December, the Committee listened to our objections and reworked this bill making it more acceptable,Û said McKinley.  ÛÏNow it provides needed funds for areas like the First District and makes targeted cuts to broken programs. This proves Congress can come together to get the work done the American public elected us to do.Û",Republican
130377260362609_576821669051497,Rep. McKinley meets with members of the VFW 826 in Kingwood at this Veteran's Roundtable meeting.  This is another in a series of meetings with veterans in the First District in W.Va.,Republican
130377260362609_571430699590594,Rep. McKinley will be speaking to those attending this rally.  We will provide pictures and video of the event Tuesday.,Republican
130377260362609_562275430506121,"For many of you, it's a good weekend to get out and enjoy the beautiful fall colors in our state.",Republican
130377260362609_542264232507241,"The ObamaCare ""train wreck"" continues...",Republican
130377260362609_529220173811647,"Rep. McKinley, Sec. of Energy Ernest Moniz, WVU President Jim Clements and others tour the National Energy Technology Laboratory (NETL) in Morgantown, W.Va., on Monday.",Republican
130377260362609_527012614032403,"Join Rep. McKinley as he joins Howard Monroe on his show beginning at 9:06 this morning on WVLY/WKKX Radio. You can listen ""live"" by clicking below.",Republican
130377260362609_523979857669012,"Rep. McKinley Expresses Support for National Boy Scout Jamboree in West Virginia.     
 
 McKinleyÛªs Bipartisan Resolution Includes 17 Co-Sponsors Honoring Scouts and Volunteers.
 
 Washington, D.C. ÛÓToday, Rep. David B. McKinley, P.E. (R-WV) was joined by 17 of his colleagues, the majority of which is Eagle Scouts, in supporting the on-going National Boy Scout Jamboree being held this week in Fayette County, W.Va.  
 
 This is the first time the Jamboree has been held in the Mountain State, and the event brought nearly 50,000 Scouts, leaders, volunteers and others to the new site.  The first Boy Scout Jamboree took place in 1937 in Washington, D.C.
 
 ÛÏAs an Eagle Scout, I could not be more proud that my home state of West Virginia is hosting the Jamboree and will serve as the permanent home for the event in the coming years,Û said Rep. McKinley.  ÛÏThis week, thousands of Scouts from around the United States, their leaders and others have travelled to the new facility near the New River Gorge to celebrate Scouting and participate in activities to build leadership and character.Û
 
 The site, known as the Summit Bechtel Family National Scout Reserve, will house Scouts, staff and adult leaders, who will enjoy the outdoors and test their abilities in a number of ways.  
 
 Rep. McKinleyÛªs office also helped in sending 90-year-old Carlyle Farnsworth, a Wheeling resident, to this yearÛªs Jamboree.  Farnsworth is also an Eagle Scout and attended the first jamboree back in 1937.
 
 ÛÏThe lessons I learned as a young man in the Boy Scouts in Troops 23 and 6 in Wheeling, W.Va., have stuck with me throughout my life and guided my decisions in my personal and professional career,Û added McKinley.  ÛÏI look forward to talking with the campers and touring the site, first-hand, this weekend.Û
 
 The resolution acknowledges that because of this new world-class facility in Fayette County, W.Va., this site will now be home to the next World Boy Scout Jamboree.  ItÛªs the first time it has been held in the United States in 52 years.",Republican
130377260362609_507698349297163,"Nine things you never knew about Flag Day.    #8.  Each year, the President must proclaim Flag Day.    In 1949, Congress issued a joint resolution stating that the president must issue a proclamation each year calling for the national observance of the flag, and that it must be displayed on all federal government buildings.   On June 7, President Obama issued this year's Presidential Proclamation of Flag Day and National Flag Week.",Republican
