Id,Text,Party
139773069370563_673211436026721,"The Voting Rights Act of 1965 remains one of the most important and historic pieces of legislation ever enacted by the United States Congress.  Section five of the act has successfully protected voters from discrimination and it is extremely disappointing the Supreme Court has rolled back these provisions.  Elections are the keystone of representative democracy and Congress should act to ensure that all citizens can exercise their constitutional right to cast a ballot in a manner that is equitable, accessible, free and fair.",Democrat
6460640558_10152871317715559,Greta and her viewers have been pushing for Sgt. #Tahmooressi's release for months. Thank you to everyone for your support!,Republican
6460640558_10152785733740559,Thanks to Jill #Tahmooressi for her courage while testifying about her son Andrew today: http://1.usa.gov/YEq5Zj #BringBackOurMarine,Republican
6460640558_10152579554535559,Getting ready for fireworks at the City of La Habra 4th of July Festival. Lot of families having a great time here.,Republican
6460640558_10152554880085559,"I recently wrote Speaker Boehner to request a Joint Session of Congress for Indian Prime Minister Narendra Modi during his visit to America in September. Prime Minister Modi is head of the conservative political party in India and now leads the world's most populous democracy, a country that is a critical ally to the United States. I met with Indian Ambassador Dr. S. Jaishankar to discuss my proposal: http://1.usa.gov/1jesfm6",Republican
6460640558_10151726742060559,I'm looking forward to joining some great Independence Day celebrations in the 39th district tomorrow. How are you and your family celebrating our nationÛªs birthday? Share some of your favorite 4th of July traditions in the comment section below!,Republican
6460640558_10151628572795559,A nuclear Iran is the gravest threat facing the U.S. and our allies.  The U.S. must respond with crippling sanctions. That's why I am convening a hearing tomorrow in the House Foreign Affairs Committee to ask Administration officials critical questions regarding the U.S. policy toward Iran. Read more at foreignaffairs.house.gov.,Republican
230753786936538_842169609128283,The Federal Housing Finance Agency (FHFA) today announced it is taking new steps to reach homeowners who could benefit from the Home Affordable Refinance Program (HARP). Call my office for more information at 773-224-6500.,Democrat
171770326187035_833767606653967,Did you know September is National Preparedness Month? Use these helpful tips from American Red Cross to be prepared in the event of an emergency! ,Republican
171770326187035_797826633581398,"This week, during my Teletown Hall event, I asked constituents who they thought was to blame for the immigration crisis at our Southwest Border. You'll see that 90% believe the Obama Administration is at fault. Who do you think is at fault? Comment below.",Republican
171770326187035_790213771009351,Today we celebrate a great Alabamian whose statue is in the United States Capitol Visitors' Center.,Republican
171770326187035_781008668596528,See what's on the House floor this week: http://majorityleader.gov/floor/weekly.html,Republican
171770326187035_755067541190641,A member of my staff will be holding Mobile Office Hours at City Hall in Alexander City from 1-3 CDT today. Stop by if you need any assistance!,Republican
171770326187035_744718262225569,"This week, the House will consider HR 2575, the Save American Workers Act. This bill will protect hardworking Americans from the harmful impacts of the PresidentÛªs health care law in the job market and at the doctorÛªs office.",Republican
171770326187035_10202231027349600,Read my statement on CBO's latest report here: http://mike-rogers.house.gov/press-release/rogers-cbo-report-obamacare-threatens-jobs ,Republican
171770326187035_685606981470031,ICYMI: Rogers: No U.S. Ground-Stations for Russia http://mike-rogers.house.gov/press-release/rogers-no-us-ground-stations-russia,Republican
171770326187035_665912033439526,A member of my staff will be holding Mobile Office Hours at City Hall in Smiths Station from 10 a.m.- 12 p.m. EST today. Stop by if our office can be of service to you.,Republican
171770326187035_591075757589821,"Today, we remember those who made the ultimate sacrifice.",Republican
171770326187035_590777587619638,"Targeting conservatives by day, partying by night- The IRS.",Republican
184756771570504_614146175298226,TeamDutch earlier today helping constituents facing foreclosure in Randallstown:,Democrat
184756771570504_550480631664781,"Elliott's last lunch on the SNAP Challenge - his last pork chop, pasta and a little sauce. Could you live off $4.50 a day?",Democrat
184756771570504_533241363388708,Busy day in the district - first stop - opening the new Vets Center in Dundalk! What could be better?,Democrat
184756771570504_523554834357361,My interview with Fox on the attack in Boston and tainted mail on Capitol Hill...,Democrat
184756771570504_220574058084547,Just posted new tools for tax prep including where to find free one-on-one help and filing software...,Democrat
121560497865_10152729847362866,Great to be in Akron with Joe Cronauer and 95.5 at the walk to end Alzheimer's disease,Democrat
121560497865_10151802968862866,Treasury & IRS announce today that they will treat legal same-sex marriages same as heterosexual marriages for federal taxes http://bit.ly/12QtV02,Democrat
121560497865_10151552208852866,"I want to recognize that April is Alcohol Awareness Month, a time in which we strive to remove the stigma and focus on reducing alcoholism and alcohol-related issues.",Democrat
118777661469195_966028916744061,"In my latest installment of Ask Peter, I respond to an e-mail from Karen Werle in Algonquin who asked about #Obamacare architect Jonathan GruberÛªs comments that passing Obamacare relied on the ÛÏstupidity of the American voterÛ and a ÛÏlack of transparency.Û The American people are not fooled. This law was crafted behind closed doors and rammed through Congress on a partisan voteÛÓand the results have been disastrous. As a result, millions have been kicked off their healthcare plans or have seen their premiums skyrocket, while businesses have been forced to cut-back their workforces. ThatÛªs why I introduced legislation to create an independent watchdog to monitor Obamacare, which would help bring much-needed transparency and accountability to the PresidentÛªs healthcare law. #GruberGate",Republican
118777661469195_946791185334501,"There are approximately 400,000 people living with Down syndrome in the United States and millions more across the globe. Today, nearly one in every 691 babies is born with Down syndrome. As a member of the Congressional Down Syndrome Caucus, I have been a strong supporter of legislation like the ABLE Act, which helps empower children with special needs to live as independently as possible. October is Down Syndrome Awareness Month, so please join me in standing in solidarity with all those affected by this disorder as we press on in the fight to understand, treat, and hopefully prevent Down syndrome. #DSAM2014",Republican
118777661469195_811838798829741,"On Sunday, Fox News featured my bill to create a Special Inspector General for Monitoring the Affordable Care Act, or SIGMA, following the successes of other recent special inspectors general. Check it out here: http://youtu.be/dqMK3CIxuwE.",Republican
118777661469195_704300812916874,"Great #ChicagoTribune editorial to read this AM on how the health care law's online health insurance exchanges are set to open in less than a month, on October 1. Yet, Illinois families and individuals are still in the dark about how much they will have to pay for health care and what exactly their coverage will look like in 2014. #trainwreck",Republican
130725126985966_699133633478443,"Today I announced the winners of the 2014 Congressional Art Competition. This was the 17th year for the competition in the First Congressional district, and 12 area schools participated with 52 student entries.   Winners are:  First Place:  Beth Stevens - Daniel Boone High School  Second Place:  Marisa Williams ÛÒ Unaka High School  Third Place: Peyton Christian- Sullivan North High School  Honorable Mentions:  Randi Buck-  Cherokee High School  Diana GuzmanÛÒGreeneville High School   Read my press release here: http://roe.house.gov/news/documentsingle.aspx?DocumentID=377626",Republican
130725126985966_686545341403939,Today is Throwback Thursday so I thought I'd share this picture from just a couple Thanksgivings ago. Can you guess which kiddo in this photo is me? #TBT,Republican
130725126985966_655013914557082,"It's an honor to chair the House Veterans' Affairs Committee this morning for Chairman Miller. Today's oversight hearing is entitled ÛÏWhat can the Federal Government Learn from the Private SectorÛªs Successful Approach to Hiring Veterans?Û 
 
 You can watch the hearing live here: http://www.ustream.tv/channel/hclive14",Republican
130725126985966_621082797950194,"Today, the VA Medical Center in Mountain Home was named a ÛÏtop performerÛ by The Joint Commission, an independent panel that accredits health care organizations. Out of 151 VA medical facilities nationwide, 32 were named ÛÏtop performers,Û including Mountain Home, based The Joint CommissionÛªs annual review of evidence-based care that is closely linked to positive patient outcomes.  I am proud to see Mountain Home recognized for their efforts to provide first-class health care to veterans in East Tennessee and around the region. The staff at Mountain Home works tirelessly on behalf of our veterans and I canÛªt think of another group of people more deserving of this tremendous honor. Each time I visit the hospital I am impressed by the professionalism of the staff and the quality of care they provide, and I am glad to see their efforts recognized nationally.  You can read my press release congratulating Mountain Home by visiting my website.",Republican
130725126985966_556734904384984,"Today, I asked the non-partisan Congressional Research Service,  CongressÛªs research arm, to investigate President Obama's authority to delay the employer mandate required by the Affordable Care Act.  The AdministrationÛªs delay is a formal admission that this law canÛªt be fixed. Delaying the employer mandateÛÓwhile preserving the requirement that individuals purchase insuranceÛÓonly postpones the inevitable catastrophe that is Obamacare.  This action raises a lot of questions about whether the Obama Administration can simply ignore the law when itÛªs convenient for them. As Chairman of the Subcommittee on Health, Employment, Labor, and Pensions, I am going to get to the bottom of this question.",Republican
117697790448_10152392953725449,SHARE if you agree that VA bureaucrats who denied care to sick and dying veterans should face criminal investigations and prosecutions for deaths that occurred on their watch. http://rooney.house.gov/press-releases/rooney-calls-for-criminal-investigations-into-va-waiting-list-deaths/,Republican
117697790448_10152208291315449,Agree?,Republican
117697790448_10151886285985449,Today I spoke on CNN about my opposition to the use of American military force in the Syrian civil war. You can watch the video here - please take a look and let me know what you think about this issue. http://www.youtube.com/watch?v=jB0RoVHNCbU&feature=youtu.be,Republican
102449199835273_718458398234347,"We pause and recall the events and sacrifice of September 11th, 2001.  To all those who lost their lives on that fateful day in New York, at the Pentagon, and on Flight 93, your loss is etched on our memories and our hearts. To the bold and tireless first responders who gave all on that day, and in the days that followed, know that your passing left a shining example of courage and sacrifice in the face of terror and darkness.  As we again face looming dangers on the horizon, the example set on September 11th by our fellow Americans is one we should look to again: American strength, sacrifice, endurance and compassion stood strong the face of evil.  It should be a reminder that we are a resilient nation, and those who seek to rule by repression, fear, violence, and extremism will never overcome the exceptional character and will of the American people.",Republican
102449199835273_668350683245119,"This week, we met with Sally Welsh (left) and Joy Buck (right) of the Hospice and Palliative Nurses Association (HPNA).",Republican
102449199835273_10201884722224030,"A quick reminder that we have more town halls this Saturday ÛÒ March 15th ÛÒ in Ontario, Seneca & Tompkins counties. Looking forward to seeing many of you there: http://1.usa.gov/O34nIR  ",Republican
102449199835273_482179938528862,At Camp Good Days and Special Times today to highlight legislation to help find a cure for cancer in our lifetime.,Republican
187639524595278_956945174331372,Great to see Parma Mayor Tim DeGeeter & City Council President Sean Brennan this afternoon,Republican
187639524595278_900253713333852,Ohio has suffered a devastating loss.Thinking of and praying for all of those who lost loved ones in Afghanistan this week. WKYC Channel 3 - Cleveland reports on the tragedy - read it here: http://tinyurl.com/qdgh4v7,Republican
187639524595278_866012290091328,ICYMI: Cleveland Plain Dealer: U.S. Rep. Jim Renacci to tour The Shoppes at Parma redevelopment site: http://tinyurl.com/lqq6b53 ,Republican
187639524595278_858494897509734,"'Like' your favorite artwork between April 10-April 21 to choose our inaugural ""People's Choice Award""! Support your favorite local high school artist. The student whoÛªs artwork receives the most ÛÏlikesÛ by 5:00 pm on April 21, 2014 will be recognized as the winner.",Republican
187639524595278_822218011137423,"ÛÏ'ObamaCare"" is useful shorthand for the Affordable Care Act not least because the law increasingly means whatever President Obama says it does on any given day. His latest lawless rewrite arrived on Monday as the White House decided to delay the law's employer mandate for another year and in some cases maybe forever.Û Read more from the Wall Street Journal's editorial here: http://tinyurl.com/lq5nvao",Republican
197737020257085_808016535895794,Happy Birthday! James E. Clyburn,Democrat
197737020257085_782428685121246,To receive news and updates sign up for my newsletter Richmond.house.gov/contact-me/newsletter,Democrat
197737020257085_775016945862420,Really enjoyed speaking with Kipp Believe College Prep High School Students at the Capitol yesterday!,Democrat
197737020257085_742543455776436,Congratulations to the Montford Point Marines on being awarded Congressional Gold Medals #LongOverdue,Democrat
197737020257085_158061631010867,I'm pleased Huntington Ingalls is taking concrete steps to keep Avondale's workers on the job.  http://www.nola.com/business/index.ssf/2013/02/huntington_ingalls_to_open_hou.html,Democrat
197737020257085_252803458185772,"Congrats to the Americanidol contestants from LaPlace, Baton Rouge and NOLA who are going to represent us in Los Angeles! Let's tune in next week to cheer them on! I know they will continue to make us proud! http://www.fox8live.com/video?clipId=8227537&autostart=true",Democrat
174519582574426_827280670631644,I met earlier today with leadership from the Civil Air Patrol which is based at Maxwell-Gunter Air Force Base in Montgomery. I look forward to learning more about the important work they do during a visit to their facility at Maxwell next month.,Republican
174519582574426_818994438126934,Yesterday I met with doctors from across Alabama's Second District who were visiting Washington D.C. with the Medical Association of the State of Alabama. We talked about how new federal rules and regulations are hurting their industry.,Republican
174519582574426_742907649068947,"More debt w/ zero spending reforms? Unacceptable.  I strongly believe we must act to avoid defaulting on our debt payments and reopen the government. But I cannot support a plan that increases our nationÛªs debt by half a TRILLION dollars while offering no spending reforms. WashingtonÛªs addiction to spending is what led to this mess, and piling on more debt while ignoring the spending problem is exactly the wrong approach.  A better way forward would be honest, simple legislation that (1) takes care of our debt needs with corresponding spending reforms, (2) provides temporary government funding, and (3) allows us time to work toward a real budget. I know a majority of Republicans and Democrats would ultimately support such a plan. The problem is the Û÷shutdown strategyÛª damaged the HouseÛªs bargaining power in these negotiations.  I hope conservatives can now regroup and begin work on achievable priorities that are important to regular Americans: striving to protect Americans from ObamaCareÛªs harmful mandates and taxes, setting sustainable spending levels that continue to drive down the deficit, and pushing a pro-growth agenda that will help create jobs for people in Alabama and throughout the country. http://www.wsfa.com/story/23711725/rep-roby-to-vote-no-on",Republican
174519582574426_708307222528990,REMINDER: Tomorrow I am kicking off my #MarthaListens Town Hall Tour in Prattville!  I look forward to this valuable opportunity to listen to your ideas and concerns about the federal government.  Click here for other locations: http://roby.house.gov/upcomingevents,Republican
174519582574426_651747468184966,I visited Afghanistan over Mother's Day weekend to meet with our military men and women in combat.  I also had the chance to visit with Afghanistan military leaders to check the status of their operations.,Republican
174519582574426_626702620689451,"Did you see todayÛªs Wall Street Journal article about the number of people on food stamps growing?  With unemployment slowly decreasing and the economy getting slightly better, wouldnÛªt it make sense that the number of people depending on food stamps would also improve? When it comes to programs like this, we have to ensure money spent is going toward those who truly need it most.  I look forward to a thoughtful debate later this year regarding ways to eliminate fraud and abuse within the food stamp program to ensure the system actually works for those who need it.
 
 More here: http://roby.house.gov/use-food-stamps-swells-even-economy-improves",Republican
174519582574426_616211885071858,"Earlier this week, I had the opportunity to meet with some young political leaders from Brazil during their visit to Washington.  The students will also be visiting Montgomery and Birmingham to learn about our form of government.  They shared with me a small 3D model of the National Congress of Brazil.  Join me in welcoming the student leaders to our country and our state!",Republican
183180288372896_864269546930630,"Looking back, my last month has been full of fantastic meetings with Hoosiers and proud Americans. Seeing all of us in this photo album reminds me of the hard work we've done, and the hard work we've yet to do. As your Congressman, I will continue to fight for us and our families, so that we can build better lives for ourselves.",Republican
183180288372896_849319461758972,Great visit to Greencastle on Tuesday. Were you able to attend a recent Town Hall?,Republican
183180288372896_808594315831487,I spent the afternoon with the AAOE - American Association of Orthopaedic Executives for a Town Hall on the state of the health care industry.  I was joined by Pete Sessions & Rep. Larry Bucshon.  Our doctors and medical professionals are frustrated by the uncertainty and consequences of ObamaCare.,Republican
183180288372896_768671906490395,$163m+ in #MedicareAdvantage cuts in 2015 as a result of ObamaCare. We must #KeepThePromise,Republican
183180288372896_10101028111867534,"AmericaÛªs entrepreneurs are left with much more expensive, second-rate health insurance because of ObamaCare.",Republican
183180288372896_10100984562615584,A Crawfordsville woman with cancer is suffering because President Obama lied about her ObamaCare choices.,Republican
183180288372896_726836277340625,Let's Go Indianapolis Colts!,Republican
183180288372896_726236304067289,"Some new and interesting takeaways from the Oregon Medicaid study from earlier this year.  Insurance costs are lower for lower-income (offset by increased costs for middle and upper-class), but health care costs and ER use are up.  Link to Oregan study is in the aritcle.",Republican
183180288372896_697969846893935,"This is not a faculty lounge exercise.  Real people ÛÒ men, women and children are suffering.  TodayÛªs news is just the latest evidence that ObamaCare is failing.  Proponents said ObamaCare was necessary to insure the uninsured.  Not only has ObamaCare failed to insure the uninsured, it has added millions of Americans to the ranks of the uninsured, the unemployed, and the underemployed.  ItÛªs time for the President to join us in at least delaying ObamaCare, if not beginning its outright repeal.  http://rokita.house.gov/press-release/release-obamacare-numbers-millions-lose-health-insurance-only-26000-sign",Republican
183180288372896_690669837623936,IÛªll be live at 7:10 pm ET on Lou Dobbs Tonight on Fox Business to discuss the latest on the #insidious lies of #ObamaCare.,Republican
183180288372896_659570050733915,"Another example of ÛÏpass it to see whatÛªs in itÛ ÛÒ clearly if you like your health insurance, youÛªre at risk at not keeping it.  We must repeal this #TrainWreck",Republican
183180288372896_655509237806663,Tx to the Crawfordsville Public Library for hosting yesterday's productive COYC.,Republican
183180288372896_653585394665714,LIve at 10:30 am on Garrison (Doug Rose is in as host today) on 93.1 WIBC-FM.  Tune-in on air or live at the link: http://www.wibc.com/garrison/,Republican
183180288372896_640531015971152,I'll be live with Jed on WJOB 1230 AM tomorrow to talk about Obamcare at 8:45a ET. Listen live:,Republican
183180288372896_620488054642115,I'm very proud of my team in delivering the lowest congressional office rent costs in the entire country.,Republican
183180288372896_616518521705735,I'll be live with my friend Dana Loesch on The Dana Show 3:00 PM ET to talk about NSA surveillance. You can stream it live at the link below or listen on-air to 93.1 WIBC-FM tonight at 8 PM ET.,Republican
183180288372896_610140159010238,"This is Deanna Jones and her son, Jeffry, with me after yesterday's ceremony in Lebanon. Deanna began the process of adopting Jeffry from Haiti in 2006, and I had the privilege of signing the papers as the adoption was processed during my service as Indiana's Secretary of State. It was great to visit with both Deanna and Jeffry!",Republican
183180288372896_602858159738438,Go Frankfort!,Republican
183180288372896_589300794427508,"Honored to be the keynote speaker at the Lake County Lincoln Day Dinner tonight at 7 PM ET at St. Elijah's in Merrillville.  Always nice to go ""home"" and see old friends.  Look for pictures from the event tomorrow.",Republican
183180288372896_599265243434938,The House Budget Committee will hold a legislative mark up hearing of the FY 2014 House Budget at 10:30 AM today. Bring your popcorn and watch live:,Republican
183180288372896_142711519228440,"Newman: ""So while sequestration, if it sticks, would help narrow federal deficits for a few years, it will take much deeper cutbacks to truly align federal spending with what the nation can afford. That's why budget battles, including efforts to streamline the tax code and make entitlement programs like Medicare more affordable, are likely to go on for years.""",Republican
183180288372896_556239467733641,"Ryan helped make the cake. Why two candles? That's how many Ryan would allow.  Old Style is my traditional beer, as a Cubs fan. Hard to find in central Indiana. Common place in the region. 219!",Republican
469477579757018_788051817899591,"Is your child interested in applying to one of our nationÛªs greatest service academyÛªs? Please join my office along with the offices of Congressman Tom Rooney and Congressman Daniel Webster this Saturday for Service Academy Day. Representatives from West Point - The U.S. Military Academy, US Air Force Academy (Official), United States Naval Academy, U.S. Coast Guard Academy, United States Merchant Marine Academy and Florida Southern College Army ROTC (Moccasin Battalion ROTC) will be in attendance. Information will be provided on the service academy application process and acceptance requirements. http://1.usa.gov/1vPHkSR",Republican
469477579757018_695693117135462,"Proud to be named a ""Champion of Health Care Innovation"" by the Healthcare Leadership Council. If we are ever going to consistently provide patients with the highest quality care, at the lowest price, innovation is absolutely essential. We need to make sure that researchers can continue to create life-saving drugs and that doctors and surgeons can spend their time treating patients ÛÒ not tied up in unnecessary paperwork and weighed down with extensive burdensome taxes and fees that are then passed along to the patient. Whether itÛªs increased cancer detection ability, a quicker Lyme disease diagnosis, or improved quality of life through a new wheelchair, I will continue to push for innovations that help those who are hurting.",Republican
469477579757018_10200528250647433,Are you a high school student and want your artwork displayed in the U.S. Capitol? Congressional Art Competition Deadline for is Mid-March ,Republican
